{
  "schema_version": 1,
  "id": "example-story",
  "title": "Example Story",
  "language": "en",
  "entry_node": "start",
  "description": "Replace with a short player-facing description.",
  "origin": {
    "original_title": "Original title",
    "authors": ["Original author"],
    "source_url": "https://example.com/original",
    "source_type": "public-domain"
  },
  "rights": {
    "status": "unverified",
    "license": null,
    "jurisdiction_notes": "",
    "attribution_required": true
  },
  "voice": {
    "announce_origin_before_play": true,
    "origin_announcement": "This story is adapted from \"Original title\" by Original author."
  }
}
